{
  "admission_eligible": false,
  "evidence_scope": "source_backed_development_replay_only",
  "independent_evaluator": false,
  "independent_property_validation": false,
  "independent_trigger_validation": false,
  "native_evm_replay": true,
  "network_mode": "none",
  "observed_at": "2026-09-12T12:14:07.228954Z",
  "receipts": [
    {
      "admission_eligible": false,
      "artifact_manifest_sha256": "033472f18ce78f6feaea10e938734cf55164e6d593a2fa4c73a309b0e3b69636",
      "compiler": {
        "binary_sha256": "addf724dcb862a48f0d0ce3407b58719dee759e5e4c4ed65023d8a060d523162",
        "image": "ghcr.io/argotorg/solc@sha256:664760e66dfbe2f335d71060a8d78b908ac3d1887339a65e9286b8b72d0db5ba",
        "path": "/compiler/solc",
        "version": "0.8.9"
      },
      "evidence_scope": "source_backed_development_replay_only",
      "independent_evaluator": false,
      "independent_property_validation": false,
      "independent_trigger_validation": false,
      "initialization_sha256": "d8387a2a2c286dbfcd9002767d21fdf876b8e7d76df56cd926c3f50f6441e2bc",
      "lineage_id": "celer_cbridge",
      "native_evm_replay": true,
      "network_mode": "none",
      "observed_at": "2026-09-12T12:14:07.228954Z",
      "profile_sha256": "a16287f69389e08c55ea16517d022574c8107e94192bdaeb5b5ff7c85bc57f51",
      "receipt_hash": "47918c206d95d908c6b4d6b6a18011674ac72df74265cbb75b0ab4289c764e17",
      "record_type": "source_backed_independent_evm_replay",
      "replay_spec": {
        "artifact_hash": "033472f18ce78f6feaea10e938734cf55164e6d593a2fa4c73a309b0e3b69636",
        "compiler_image_ref": "ghcr.io/argotorg/solc@sha256:664760e66dfbe2f335d71060a8d78b908ac3d1887339a65e9286b8b72d0db5ba",
        "compiler_version": "0.8.9",
        "compiler_volume": "crossllm-solc-30508-4e9bc567155f",
        "image_ref": "ghcr.io/foundry-rs/foundry@sha256:0c00cb0bda1ab1b91c9a6bf60f4c76c09c1a8870824b6d4718afbabacf6f9a17",
        "initialization_hash": "d8387a2a2c286dbfcd9002767d21fdf876b8e7d76df56cd926c3f50f6441e2bc",
        "network_mode": "none",
        "profile_hash": "a16287f69389e08c55ea16517d022574c8107e94192bdaeb5b5ff7c85bc57f51",
        "project_path": "E:\\School\\UIT\\CROSS LLM\\dataset\\harness\\celer_cbridge",
        "schema_version": 1,
        "semantic_engine": "independent-foundry-evm",
        "spec_hash": "c6cb03ce22e8b71004c7ed40cfd930df068e057ba56a7c4cc693924c21b753e4",
        "support_matrix_hash": "b84e84fc6e150da6c5f9513a53435187eb83e3a60d8b6af0ef03de67fb5ee53d",
        "test_filter": null,
        "timeout_seconds": 300.0,
        "tool_revision": "foundry-1.8.1"
      },
      "result": {
        "elapsed_seconds": 5.387125599998399,
        "exit_code": 0,
        "failed_tests": 0,
        "passed_tests": 3,
        "reason": null,
        "schema_version": 1,
        "spec_hash": "c6cb03ce22e8b71004c7ed40cfd930df068e057ba56a7c4cc693924c21b753e4",
        "status": "pass",
        "stderr_hash": "e3b0c44298fc1c149afbf4c8996fb92427ae41e4649b934ca495991b7852b855",
        "stdout_hash": "7324d7a50fe4739c5fc9295f13ccb59a4b1f95d4d55d1b5021fa104eb93f2c17",
        "test_count": 3
      },
      "schema_version": 1,
      "scope": "source_backed_development_replay_only",
      "source_backed": true,
      "source_commit": "d1a097be65b3c9f0f89fabacc988de68770caa18",
      "source_file_sha256": "851d8610f4a6f90f973227c5c75ceb902eb8a4f3ff20dc775e21cb303fa0f6d2",
      "source_manifest_sha256": "21f2ee68cce6371105b655d915e5521a68145784e4605c4d9896e53634cf946d",
      "source_repository": "https://github.com/celer-network/cBridge-contracts.git"
    },
    {
      "admission_eligible": false,
      "artifact_manifest_sha256": "4bf243b24217a1b850253219ef9ef8d7235dd799068ca6afa69319bda4d9f7a0",
      "compiler": {
        "binary_sha256": "fadfc5f198e9f4eebee03db4a3d7a71534de94281f40b5d9ac72dc6b88c7cbf1",
        "image": "ghcr.io/argotorg/solc@sha256:2fe6baaada4141dfb52cb786c11e16b77f675ee103bb1d586a446fdd572c6c66",
        "path": "/compiler/solc",
        "version": "0.8.11"
      },
      "evidence_scope": "source_backed_development_replay_only",
      "independent_evaluator": false,
      "independent_property_validation": false,
      "independent_trigger_validation": false,
      "initialization_sha256": "1b8d0ed72018fe3e99dad3457debd692fd380279bc2561c5d3c62551c06fbc9c",
      "lineage_id": "chainbridge",
      "native_evm_replay": true,
      "network_mode": "none",
      "observed_at": "2026-09-12T12:14:07.228954Z",
      "profile_sha256": "3102d9d2898a76cf90fabba843a8043cf7a371138d96a9375fa60ddb2da230e4",
      "receipt_hash": "730cd55204407e590107e769407ac94286072c88b3298400ce34aded825e6f29",
      "record_type": "source_backed_independent_evm_replay",
      "replay_spec": {
        "artifact_hash": "4bf243b24217a1b850253219ef9ef8d7235dd799068ca6afa69319bda4d9f7a0",
        "compiler_image_ref": "ghcr.io/argotorg/solc@sha256:2fe6baaada4141dfb52cb786c11e16b77f675ee103bb1d586a446fdd572c6c66",
        "compiler_version": "0.8.11",
        "compiler_volume": "crossllm-solc-30508-92f899e150fe",
        "image_ref": "ghcr.io/foundry-rs/foundry@sha256:0c00cb0bda1ab1b91c9a6bf60f4c76c09c1a8870824b6d4718afbabacf6f9a17",
        "initialization_hash": "1b8d0ed72018fe3e99dad3457debd692fd380279bc2561c5d3c62551c06fbc9c",
        "network_mode": "none",
        "profile_hash": "3102d9d2898a76cf90fabba843a8043cf7a371138d96a9375fa60ddb2da230e4",
        "project_path": "E:\\School\\UIT\\CROSS LLM\\dataset\\harness\\chainbridge",
        "schema_version": 1,
        "semantic_engine": "independent-foundry-evm",
        "spec_hash": "d966a16ae7167d2b2157bfa263b5a4d7d1ab32ac26d6a2140ba4539355f01929",
        "support_matrix_hash": "6f19c1eae0f506ec24d6274008e18c0ee2f21114dd005c2b19f339688bf6e1b1",
        "test_filter": null,
        "timeout_seconds": 300.0,
        "tool_revision": "foundry-1.8.1"
      },
      "result": {
        "elapsed_seconds": 15.672276199999033,
        "exit_code": 0,
        "failed_tests": 0,
        "passed_tests": 5,
        "reason": null,
        "schema_version": 1,
        "spec_hash": "d966a16ae7167d2b2157bfa263b5a4d7d1ab32ac26d6a2140ba4539355f01929",
        "status": "pass",
        "stderr_hash": "e3b0c44298fc1c149afbf4c8996fb92427ae41e4649b934ca495991b7852b855",
        "stdout_hash": "a10d1b992f6c74919317e182684d7de02d20750aa7e289f0e5623b7efa3360e0",
        "test_count": 5
      },
      "schema_version": 1,
      "scope": "source_backed_development_replay_only",
      "source_backed": true,
      "source_commit": "b929c980afcdffae10d61c7065a5655479638519",
      "source_file_sha256": "1d0f3bbe323bf0c9fc723f02479e0bfc21090ef54afe89db5c49ec58b1439669",
      "source_manifest_sha256": "3a9be8c22b382afcfff63b3ff21d5f997f50c4dd478eb4f1ed01ad6e9229f160",
      "source_repository": "https://github.com/ChainSafe/chainbridge-solidity.git"
    },
    {
      "admission_eligible": false,
      "artifact_manifest_sha256": "761b36837cb8c6e3927a97dff048ebf3df2e9f6a0b86d19283108bccbb4ca283",
      "compiler": {
        "binary_sha256": "ce964c1bfb05a62099633caa7360f80ba6013b3f5529daaaa080c74654a6d577",
        "image": "ghcr.io/argotorg/solc@sha256:90f88c49adfef1286f13980b65c4e6524abb4c012e4394abc53649c5fc76f6aa",
        "path": "/compiler/solc",
        "version": "0.8.36"
      },
      "evidence_scope": "source_backed_development_replay_only",
      "independent_evaluator": false,
      "independent_property_validation": false,
      "independent_trigger_validation": false,
      "initialization_sha256": "c81f201de4fad834139e051e90c96d39985bd317333225b9b98da950e6714c8f",
      "lineage_id": "layerzero_v2",
      "native_evm_replay": true,
      "network_mode": "none",
      "observed_at": "2026-09-12T12:14:07.228954Z",
      "profile_sha256": "76fabcc2a5cea86e7cbc0926398c635b6a2983bcecf53447056ca67566c56738",
      "receipt_hash": "34212f00d76d48a426955c8f7aa21b6103a0cf57ed6ba899b0c02c71e2843f07",
      "record_type": "source_backed_independent_evm_replay",
      "replay_spec": {
        "artifact_hash": "761b36837cb8c6e3927a97dff048ebf3df2e9f6a0b86d19283108bccbb4ca283",
        "compiler_image_ref": "ghcr.io/argotorg/solc@sha256:90f88c49adfef1286f13980b65c4e6524abb4c012e4394abc53649c5fc76f6aa",
        "compiler_version": "0.8.36",
        "compiler_volume": "crossllm-solc-30508-a17adfae7105",
        "image_ref": "ghcr.io/foundry-rs/foundry@sha256:0c00cb0bda1ab1b91c9a6bf60f4c76c09c1a8870824b6d4718afbabacf6f9a17",
        "initialization_hash": "c81f201de4fad834139e051e90c96d39985bd317333225b9b98da950e6714c8f",
        "network_mode": "none",
        "profile_hash": "76fabcc2a5cea86e7cbc0926398c635b6a2983bcecf53447056ca67566c56738",
        "project_path": "E:\\School\\UIT\\CROSS LLM\\dataset\\harness\\layerzero_v2",
        "schema_version": 1,
        "semantic_engine": "independent-foundry-evm",
        "spec_hash": "78e1d6aa77fa97504b7625570121ac5bdcafa954666d547c8075135eefb70a95",
        "support_matrix_hash": "fe9c8cca6e18603e91c972cd049d03f54eaf3ac1024191238e7cd864c94717da",
        "test_filter": null,
        "timeout_seconds": 300.0,
        "tool_revision": "foundry-1.8.1"
      },
      "result": {
        "elapsed_seconds": 10.65604280000116,
        "exit_code": 0,
        "failed_tests": 0,
        "passed_tests": 5,
        "reason": null,
        "schema_version": 1,
        "spec_hash": "78e1d6aa77fa97504b7625570121ac5bdcafa954666d547c8075135eefb70a95",
        "status": "pass",
        "stderr_hash": "e3b0c44298fc1c149afbf4c8996fb92427ae41e4649b934ca495991b7852b855",
        "stdout_hash": "44510fd719b9dca181ddf96f17f52abc7bfe7a6046edc4d5ae601c0e74dd0c27",
        "test_count": 5
      },
      "schema_version": 1,
      "scope": "source_backed_development_replay_only",
      "source_backed": true,
      "source_commit": "9c741e7f9790639537b1710a203bcdfd73b0b9ac",
      "source_file_sha256": "9a98cafb9aa071bdd70e048fdba2bc8cc69e98f499fb31feaa2f7d821104f8f6",